id,start_date,motion:text,motion:result,motion:requirement
57693,2013-03-27T14:35:00,N.z. o Českém národním povstání,fail,simple majority
57462,2013-02-15T11:55:00,Novela z. - zákoník práce,pass,simple majority
57138,2012-12-18T18:56:00,Novela z. - transplantační zákon - EU,fail,simple majority
58155,2013-08-08T10:17:00,Vl.n.z.o změně daň.zák. v souv. s rekodifikací soukrom.práva - EU,fail,simple majority
57863,2013-05-15T08:56:00,Novela z. o státním podniku,pass,simple majority
57735,2013-05-07T14:04:00,Pořad schůze,pass,simple majority
57912,2013-05-16T09:49:00,Sml.mezi ČR a Brazil.fed.rep.o pomoci v celních otázkách,pass,simple majority
57261,2013-02-06T16:24:00,Novela z. o pojišťovacích zprostředkovatelích - EU,pass,simple majority
57038,2012-12-12T11:50:00,Novela z. o platu představitelů státní moci,pass,simple majority
57470,2013-02-19T12:28:00,Pořad schůze,pass,simple majority
57779,2013-05-10T09:16:00,Novela z. o soudních poplatcích,pass,simple majority
58285,2013-08-16T10:18:00,Novela z. o sociálních službách,fail,simple majority
57349,2013-02-12T14:04:00,Pořad schůze,fail,simple majority
57828,2013-05-15T07:19:00,Pořad schůze,pass,simple majority
58112,2013-07-17T15:33:00,Novela z. o vodovodech a kanalizacích - EU,pass,simple majority
57631,2013-03-26T17:41:00,Vl.n.ústav.z. o celostátním referendu,pass,simple majority
58080,2013-07-17T14:38:00,Novela z. o směnárenské činnosti - související,pass,simple majority
57738,2013-05-07T14:07:00,Pořad schůze,pass,simple majority
57900,2013-05-15T14:41:00,Vl.n.z. o dani z nabytí nemovitých věcí,pass,simple majority
57603,2013-03-22T11:40:00,Informace ministryně práce a sociálních věcí k s-Kartám,pass,simple majority
58215,2013-08-08T14:33:00,Vl.n.z. o povinném značení lihu - EU,pass,simple majority
57468,2013-02-19T12:26:00,Pořad schůze,pass,simple majority
57386,2013-02-13T09:18:00,Vl.n.z. o změně zák. v oblasti pojišťov. a penzij. připojiš. - EU,pass,simple majority
57124,2012-12-18T17:29:00,Novela z. o platu představitelů státní moci,pass,simple majority
58195,2013-08-08T13:59:00,Vl.n.z. o zvláštních řízeních soudních - EU,pass,simple majority
57117,2012-12-18T13:17:00,,fail,simple majority
57058,2012-12-13T08:42:00,Pořad schůze,fail,simple majority
57342,2013-02-12T13:58:00,Pořad schůze,pass,simple majority
57645,2013-03-27T11:13:00,Novela z. o nouzových zásobách ropy - EU,pass,simple majority
57378,2013-02-13T08:57:00,Novela z. o odpadech - EU,pass,simple majority
57046,2012-12-12T14:11:00,Novela z.o vyšších soud.úřednících a vyšších úřed.stát.zast.,pass,simple majority
57626,2013-03-26T16:05:00,Novela z. o odpovědnosti za škodu způs.při výkonu veřej.moci,pass,simple majority
57730,2013-05-07T14:00:00,Pořad schůze,pass,simple majority
57550,2013-03-19T14:23:00,Pořad schůze,pass,simple majority
57624,2013-03-26T15:29:00,Novela z. o zpravodajských službách ČR,pass,simple majority
57888,2013-05-15T10:51:00,Novela z. o ověřování střelných zbraní,pass,simple majority
58274,2013-08-16T09:21:00,Novela z. o podporovaných zdrojích energie - EU,pass,simple majority
57094,2012-12-14T11:17:00,Novela z. o léčivech - EU,pass,simple majority
57949,2013-05-17T10:19:00,Vl.n.z.o změně zák.v souvisl. s přij. z. o katastr. nemovit.,pass,simple majority
58089,2013-07-17T14:59:00,Novela z. o ochraně zemědělského půdního fondu,pass,simple majority
57442,2013-02-14T11:51:00,Výroční zpráva o činnosti Pozemkového fondu ČR za rok 2011,fail,simple majority
57522,2013-03-19T13:58:00,Pořad schůze,pass,simple majority
57827,2013-05-15T07:18:00,Pořad schůze,pass,simple majority
57799,2013-05-14T12:31:00,Pořad schůze,pass,simple majority
57960,2013-05-17T11:18:00,"Novela z. o matrikách, jménu a příjmení",pass,simple majority
57074,2012-12-14T09:16:00,Pořad schůze,pass,simple majority
57635,2013-03-27T10:03:00,Pořad schůze,pass,simple majority
58057,2013-07-17T12:54:00,Návrh usnesení k usnesení o rozpuštění Poslanecké sněmovny,fail,simple majority
57134,2012-12-18T18:53:00,Novela z. - transplantační zákon - EU,pass,simple majority
57965,2013-06-11T12:57:00,Pořad schůze,fail,simple majority
58210,2013-08-08T14:29:00,Vl.n.z. o povinném značení lihu - EU,pass,simple majority
57163,2012-12-19T10:34:00,Vl.n.z. o Státním pozemkovém úřadu,pass,all representatives majority
57144,2012-12-18T19:00:00,Novela z. - transplantační zákon - EU,fail,simple majority
57413,2013-02-13T11:16:00,Novela z. - autorský zákon,pass,simple majority
57937,2013-05-17T10:04:00,Vl.n.z. o katastru nemovitostí (katastrální zákon),pass,simple majority
57854,2013-05-15T08:43:00,Vl.n.z. o investičních spol. a inv. fondech - související - EU,pass,simple majority
57816,2013-05-14T16:11:00,"N.z., kterým se zrušuje karta sociálních systémů",pass,simple majority
58282,2013-08-16T10:16:00,Novela z. o sociálních službách,pass,simple majority
57454,2013-02-15T09:15:00,Vl.n.z.o změně zák.v souvisl. s přij. z. o katastr. nemovit.,pass,simple majority
57878,2013-05-15T10:23:00,Vl.n.z.o poskyt.st.záruky ČR na zajištění půjčky ČNB pro MMF,pass,simple majority
57106,2012-12-14T11:58:00,"Vl.n.z.,kterým se upravují otázky souvis. s užíváním bytů",pass,simple majority
57500,2013-02-19T15:48:00,N.z.o změně právní formy občanského sdružení,pass,all representatives majority
58034,2013-06-18T14:37:00,Změna Přílohy I Mezinárodní úmluvy proti dopingu ve sportu,pass,simple majority
57129,2012-12-18T18:09:00,Novela z. o sociálně-právní ochraně dětí,pass,simple majority
57083,2012-12-14T09:23:00,Pořad schůze,pass,simple majority
57161,2012-12-19T09:03:00,Novela z. o přestupcích,pass,all representatives majority
57746,2013-05-07T14:13:00,Pořad schůze,fail,simple majority
57987,2013-06-11T13:20:00,Pořad schůze,pass,simple majority
58269,2013-08-16T09:18:00,Novela z. o podporovaných zdrojích energie - EU,pass,simple majority
57526,2013-03-19T14:03:00,Pořad schůze,pass,simple majority
58217,2013-08-08T14:37:00,Vl.n.z. o povinném značení lihu - související,fail,simple majority
57549,2013-03-19T14:22:00,Pořad schůze,fail,simple majority
57069,2012-12-13T12:05:00,Návrh na změny zasedacího pořádku PS,pass,simple majority
57281,2013-02-07T10:51:00,Dohoda o spol. leteckém prostoru mezi EU a Moldavskou rep.,pass,simple majority
57263,2013-02-06T17:03:00,Vl.n.z. o investičních společnostech a investičních fondech - EU,pass,simple majority
57883,2013-05-15T10:45:00,Novela z. o pohonných hmotách,fail,simple majority
58033,2013-06-18T14:33:00,Opční protokol k Úmluvě o právech dítěte,pass,simple majority
58100,2013-07-17T15:26:00,Novela z. o vodovodech a kanalizacích - EU,pass,simple majority
57924,2013-05-16T10:58:00,Novela z. o návykových látkách,pass,simple majority
57739,2013-05-07T14:07:00,Pořad schůze,pass,simple majority
57733,2013-05-07T14:02:00,Pořad schůze,pass,simple majority
58150,2013-08-08T10:13:00,Vl.n.z.o změně daň.zák. v souv. s rekodifikací soukrom.práva - EU,pass,simple majority
57604,2013-03-22T11:40:00,Informace ministryně práce a sociálních věcí k s-Kartám,fail,simple majority
57467,2013-02-19T12:25:00,Pořad schůze,pass,simple majority
57919,2013-05-16T10:25:00,Novela z. - zákoník práce,pass,simple majority
58055,2013-07-17T12:51:00,Návrh usnesení k usnesení o rozpuštění Poslanecké sněmovny,fail,simple majority
58031,2013-06-18T14:25:00,"Prot.proti pašování přistěhovalců po zemi, po moři a letecky",pass,simple majority
57112,2012-12-14T12:03:00,"Vl.n.z.,kterým se upravují otázky souvis. s užíváním bytů",pass,simple majority
57849,2013-05-15T08:27:00,Vl.n.z. o uvádění dřeva a dřevařských výrobků na trh - EU,pass,simple majority
57174,2012-12-19T17:44:00,Vl.n. nového zákona o státním rozpočtu ČR na rok 2013,fail,simple majority
57943,2013-05-17T10:10:00,Vl.n.z. o katastru nemovitostí (katastrální zákon),pass,simple majority
57199,2013-01-17T19:01:00,Návrh na vyslovení nedůvěry vládě České republiky,fail,all representatives majority
57618,2013-03-26T13:25:00,Pořad schůze,fail,simple majority
57719,2013-05-07T13:25:00,,pass,simple majority
57637,2013-03-27T10:41:00,Novela z. - zákoník práce,pass,simple majority
57741,2013-05-07T14:10:00,Pořad schůze,fail,simple majority
57113,2012-12-14T12:19:00,N.z. o obětech trestných činů - EU,pass,simple majority
57008,2012-12-11T14:17:00,Novela z. o technických požadavcích na výrobky - EU,pass,simple majority
57282,2013-02-07T10:54:00,Prot. mezi ČR a Nizozemským král. o zamezení dvojího zdanění,pass,simple majority
57023,2012-12-12T08:08:00,Pořad schůze,pass,simple majority
57641,2013-03-27T10:44:00,Novela z. - zákoník práce,pass,simple majority
57297,2013-02-08T08:20:00,Pořad schůze,pass,simple majority
57892,2013-05-15T12:48:00,Návrh časového harmonogramu projednávání SZÚ ČR 2012,pass,simple majority
57035,2012-12-12T11:01:00,Novela z. o platu představitelů státní moci,fail,simple majority
57210,2013-02-05T14:44:00,Pořad schůze,fail,simple majority
57264,2013-02-06T17:04:00,Vl.n.z. o investičních společnostech a investičních fondech - EU,fail,simple majority
57727,2013-05-07T13:58:00,Pořad schůze,pass,simple majority
57971,2013-06-11T13:04:00,Pořad schůze,fail,simple majority
57944,2013-05-17T10:10:00,Vl.n.z. o katastru nemovitostí (katastrální zákon),fail,simple majority
57419,2013-02-13T14:20:00,Novela z. o místních poplatcích,pass,simple majority
57585,2013-03-21T10:13:00,Opční protokol k Úmluvě o právech dítěte,pass,simple majority
58061,2013-07-17T14:07:00,,pass,simple majority
57773,2013-05-10T08:34:00,Novela z. o pozemních komunikacích,pass,simple majority
57084,2012-12-14T09:28:00,Informace ministryně obrany o změnách na ministerstvu obrany,fail,simple majority
57178,2012-12-19T17:47:00,Vl.n. nového zákona o státním rozpočtu ČR na rok 2013,fail,simple majority
58247,2013-08-08T15:40:00,Novela z. o podporovaných zdrojích energie - EU,pass,simple majority
57057,2012-12-13T08:41:00,Pořad schůze,pass,simple majority
58289,2013-08-16T10:56:00,Informace vlády o řešení nezaměstnanosti v MS kraji,pass,simple majority
57059,2012-12-13T08:43:00,Pořad schůze,fail,simple majority
58286,2013-08-16T10:18:00,Novela z. o sociálních službách,fail,simple majority
57181,2012-12-19T17:49:00,Vl.n. nového zákona o státním rozpočtu ČR na rok 2013,pass,simple majority
57969,2013-06-11T13:01:00,Pořad schůze,fail,simple majority
57716,2013-04-03T10:49:00,Návrh na volbu člena Nejvyššího kontrolního úřadu,fail,simple majority
57935,2013-05-17T10:02:00,Vl.n.z. o katastru nemovitostí (katastrální zákon),pass,simple majority
58160,2013-08-08T10:21:00,Vl.n.z.o změně daň.zák. v souv. s rekodifikací soukrom.práva - EU,pass,simple majority
57904,2013-05-16T09:12:00,Prot.o obavách irského lidu týkajících se Lisabonské smlouvy,pass,simple majority
57293,2013-02-07T11:52:00,Novela z. o obcích,fail,simple majority
57489,2013-02-19T12:57:00,Návrh na volbu člena Rady České televize,pass,simple majority
57239,2013-02-06T11:05:00,Vl.n.ústav.z. o rozpočtové odpovědnosti - EU,pass,simple majority
57254,2013-02-06T15:46:00,Novela z. o silničním provozu,pass,simple majority
57794,2013-05-14T12:26:00,Pořad schůze,fail,simple majority
57685,2013-03-27T14:11:00,Vl.n.z. o státním občanství České republiky,fail,simple majority
57653,2013-03-27T11:26:00,Novela z. o střelných zbraních - EU,pass,simple majority
57979,2013-06-11T13:12:00,Pořad schůze,pass,simple majority
58006,2013-06-11T14:25:00,Vl.n.z. o státním občanství České republiky,fail,simple majority
58074,2013-07-17T14:28:00,Novela z. o místních poplatcích,fail,simple majority
57391,2013-02-13T09:29:00,Novela z. o technických požadavcích na výrobky - EU,pass,simple majority
57877,2013-05-15T09:57:00,Novela z. o České národní bance - EU,pass,simple majority
57338,2013-02-12T13:55:00,Pořad schůze,pass,simple majority
57091,2012-12-14T11:13:00,Novela z. o léčivech - EU,pass,simple majority
58081,2013-07-17T14:39:00,Novela z. o směnárenské činnosti - související,pass,simple majority
57228,2013-02-05T14:57:00,Pořad schůze,pass,simple majority
57109,2012-12-14T12:00:00,"Vl.n.z.,kterým se upravují otázky souvis. s užíváním bytů",fail,simple majority
57364,2013-02-12T17:44:00,,pass,simple majority
57806,2013-05-14T12:38:00,Pořad schůze,fail,simple majority
57332,2013-02-12T13:51:00,Pořad schůze,fail,simple majority
58262,2013-08-13T12:22:00,Pořad schůze,fail,simple majority
57557,2013-03-19T16:33:00,Novela z. v souv. s přijetím rekodifikace soukromého práva - EU,fail,simple majority
58038,2013-06-18T14:53:00,Doh. mezi ČR a Čín. lid. rep. o předávání odsouzených osob,pass,simple majority
58194,2013-08-08T13:54:00,Novela z. v souv. s přijetím rekodifikace soukromého práva - EU,pass,simple majority
57636,2013-03-27T10:03:00,Pořad schůze,pass,simple majority
57600,2013-03-22T11:37:00,Informace ministryně práce a sociálních věcí k s-Kartám,pass,simple majority
57230,2013-02-05T15:00:00,Pořad schůze,fail,simple majority
57128,2012-12-18T17:43:00,Novela z. o sociálně-právní ochraně dětí,pass,simple majority
57619,2013-03-26T13:26:00,Pořad schůze,fail,simple majority
58174,2013-08-08T12:50:00,Novela z. - tiskový zákon,pass,simple majority
57384,2013-02-13T09:07:00,Novela z. o odpadech - EU,pass,simple majority
57017,2012-12-11T16:35:00,Novela z. o veřejném zdravotním pojištění,pass,simple majority
58018,2013-06-18T12:32:00,Pořad schůze,pass,simple majority
57902,2013-05-16T07:08:00,Pořad schůze,pass,simple majority
57432,2013-02-14T11:00:00,Informace o podpořeném financování za rok 2011,pass,simple majority
57355,2013-02-12T14:49:00,Novela z. o pozemních komunikacích,pass,simple majority
57835,2013-05-15T07:51:00,Novela z. o poštovních službách,fail,simple majority
57736,2013-05-07T14:05:00,Pořad schůze,pass,simple majority
57473,2013-02-19T12:30:00,Pořad schůze,fail,simple majority
57336,2013-02-12T13:53:00,Pořad schůze,fail,simple majority
57940,2013-05-17T10:06:00,Vl.n.z. o katastru nemovitostí (katastrální zákon),fail,simple majority
57789,2013-05-10T10:21:00,Novela z. o obchodu s reprodukčním materiálem lesních dřevin - EU,pass,simple majority
57362,2013-02-12T17:24:00,N.z. o Národním parku Šumava,pass,simple majority
58259,2013-08-13T12:19:00,Pořad schůze,pass,simple majority
57318,2013-02-08T11:03:00,Novela z. o jednacím řádu Poslanecké sněmovny,pass,simple majority
57401,2013-02-13T11:03:00,Novela z. - autorský zákon,fail,simple majority
58059,2013-07-17T14:02:00,,pass,simple majority
57453,2013-02-15T09:12:00,Vl.n.z. o katastru nemovitostí (katastrální zákon),pass,simple majority
58075,2013-07-17T14:29:00,Novela z. o místních poplatcích,pass,simple majority
58022,2013-06-18T12:36:00,Pořad schůze,pass,simple majority
57573,2013-03-20T14:25:00,Novela z. o majetku České republiky,pass,simple majority
58244,2013-08-08T15:20:00,"Novela z. o matrikách, jménu a příjmení",pass,simple majority
57787,2013-05-10T09:45:00,Vl.n.z. o statusu veřejné prospěšnosti,pass,simple majority
57748,2013-05-07T14:22:00,Novela z. o odpadech - EU,pass,simple majority
57324,2013-02-08T11:28:00,Vl.n.z. o označ. a sledovatel. výbušnin pro civilní použití - EU,pass,simple majority
58212,2013-08-08T14:30:00,Vl.n.z. o povinném značení lihu - EU,pass,simple majority
58219,2013-08-08T14:38:00,Vl.n.z. o povinném značení lihu - související,pass,simple majority
57745,2013-05-07T14:13:00,Pořad schůze,pass,simple majority
58101,2013-07-17T15:26:00,Novela z. o vodovodech a kanalizacích - EU,fail,simple majority
57728,2013-05-07T13:59:00,Pořad schůze,pass,simple majority
57546,2013-03-19T14:20:00,Pořad schůze,pass,simple majority
58140,2013-08-07T18:53:00,Žádost vlády České republiky o vyslovení důvěry,fail,simple majority
57868,2013-05-15T09:04:00,Novela z. o loteriích a jiných podobných hrách,fail,simple majority
57565,2013-03-20T09:39:00,Novela z. o nakládání s těžebním odpadem - EU,pass,simple majority
57329,2013-02-08T12:46:00,Novela z. - občanský zákoník,pass,simple majority
57319,2013-02-08T11:04:00,Novela z. o jednacím řádu Poslanecké sněmovny,pass,simple majority
57438,2013-02-14T11:27:00,Výroční zpráva o hospodaření Českého rozhlasu za rok 2011,pass,simple majority
57148,2012-12-18T19:16:00,N.z. o obětech trestných činů - EU,pass,simple majority
58296,2013-08-20T15:17:00,Návrh usnesení k návrhu prezidentu k rozpuštění Poslanecké sněmovny,pass,two-thirds representatives majority
57301,2013-02-08T09:33:00,Novela z. o státních svátcích,pass,simple majority
57483,2013-02-19T12:45:00,Návrh na odvolání člena DR SFDI,pass,simple majority
57673,2013-03-27T13:47:00,Novela z.o vyšších soud.úřednících a vyšších úřed.stát.zast.,pass,simple majority
57974,2013-06-11T13:07:00,Pořad schůze,pass,simple majority
58050,2013-06-19T09:51:00,Stanovení výše odměny členům Kontrolní rady Technologické agentury ČR,pass,simple majority
57209,2013-02-05T14:43:00,Pořad schůze,fail,simple majority
58042,2013-06-19T07:14:00,Pořad schůze,pass,simple majority
58058,2013-07-17T12:56:00,Návrh usnesení k usnesení o rozpuštění Poslanecké sněmovny,fail,two-thirds representatives majority
57123,2012-12-18T17:21:00,Novela z. o platu představitelů státní moci,pass,simple majority
57993,2013-06-11T13:25:00,Pořad schůze,pass,simple majority
57285,2013-02-07T11:05:00,Obchodní doh.mezi státy EU a Kolumbií a Peru,pass,simple majority
57445,2013-02-15T08:08:00,Pořad schůze,pass,simple majority
57503,2013-02-19T16:11:00,Novela z. o zdravotních službách,fail,simple majority
58040,2013-06-19T07:11:00,Pořad schůze,pass,simple majority
57997,2013-06-11T13:44:00,Novela z. o evidenci obyvatel,pass,simple majority
57287,2013-02-07T11:11:00,Doh.zakládající přidružení mezi státy EU a Střední Amerikou,fail,simple majority
57051,2012-12-12T14:38:00,Novela z. - autorský zákon,pass,simple majority
58060,2013-07-17T14:07:00,,pass,simple majority
57973,2013-06-11T13:05:00,Pořad schůze,pass,simple majority
57100,2012-12-14T11:47:00,Novela z. o vysokých školách,fail,simple majority
57088,2012-12-14T11:11:00,Novela z. o léčivech - EU,pass,simple majority
57611,2013-03-26T13:19:00,Pořad schůze,pass,simple majority
57516,2013-02-19T17:59:00,Vl.n.z.o opatřen.ke zvýšení transparentnosti akciových spol.,pass,simple majority
58054,2013-07-17T08:08:00,Pořad schůze,pass,simple majority
57147,2012-12-18T19:15:00,N.z. o obětech trestných činů - EU,pass,simple majority
57623,2013-03-26T14:08:00,Novela z. o ochraně zemědělského půdního fondu,pass,simple majority
57344,2013-02-12T13:59:00,Pořad schůze,pass,simple majority
57780,2013-05-10T09:20:00,Novela z. o soudních poplatcích,pass,simple majority
57612,2013-03-26T13:20:00,Pořad schůze,fail,simple majority
57156,2012-12-19T08:11:00,Pořad schůze,fail,simple majority
57296,2013-02-07T11:55:00,Novela z. o obcích,pass,simple majority
57395,2013-02-13T10:49:00,Novela ústav. z. - Ústava České republiky,fail,simple majority
57114,2012-12-18T13:09:00,,pass,simple majority
57639,2013-03-27T10:42:00,Novela z. - zákoník práce,pass,simple majority
57687,2013-03-27T14:13:00,Vl.n.z. o státním občanství České republiky,fail,simple majority
57381,2013-02-13T09:02:00,Novela z. o odpadech - EU,fail,simple majority
57443,2013-02-14T11:52:00,Výroční zpráva o činnosti Pozemkového fondu ČR za rok 2011,pass,simple majority
57871,2013-05-15T09:11:00,Vl. n. z. o nakládání s bezpečnostním materiálem,pass,simple majority
57759,2013-05-09T07:47:00,Písemná interpelace M. Váni na P. Nečase ve věci vládního stabil. balí,fail,simple majority
57876,2013-05-15T09:56:00,Novela z. o České národní bance - EU,pass,simple majority
57887,2013-05-15T10:49:00,Novela z. o pohonných hmotách,pass,simple majority
58248,2013-08-08T15:42:00,,pass,simple majority
57390,2013-02-13T09:25:00,Novela z. o silniční dopravě - EU,pass,simple majority
57127,2012-12-18T17:40:00,Novela z. o platu představitelů státní moci,pass,simple majority
57162,2012-12-19T10:33:00,Novela z. - horní zákon,pass,all representatives majority
58142,2013-08-08T09:41:00,Pořad schůze,pass,simple majority
57725,2013-05-07T13:56:00,Pořad schůze,fail,simple majority
58281,2013-08-16T09:29:00,Novela z. o podporovaných zdrojích energie - EU,pass,simple majority
57975,2013-06-11T13:08:00,Pořad schůze,pass,simple majority
57504,2013-02-19T16:13:00,Novela z. o zdravotních službách,pass,all representatives majority
58189,2013-08-08T13:49:00,Novela z. v souv. s přijetím rekodifikace soukromého práva - EU,fail,simple majority
57425,2013-02-14T10:27:00,Rozh.vl. o přeletech a průj.ozbroj.sil přes území ČR - 2013,pass,simple majority
57133,2012-12-18T18:37:00,Novela z. o rozpočtových pravidlech,pass,simple majority
57247,2013-02-06T11:53:00,Novela z. o stavebním spoření - EU,fail,simple majority
57961,2013-05-17T11:19:00,"Novela z. o matrikách, jménu a příjmení",pass,simple majority
57732,2013-05-07T14:02:00,Pořad schůze,pass,simple majority
57292,2013-02-07T11:27:00,Novela z. o obcích,pass,simple majority
57027,2012-12-12T08:11:00,Pořad schůze,pass,simple majority
58250,2013-08-08T16:01:00,Novela z. o sociálních službách,pass,simple majority
57580,2013-03-20T15:02:00,Vl.n.z. o povinném značení lihu - EU,fail,simple majority
57575,2013-03-20T14:30:00,Vl.n.z. o státním dluhopisovém programu,pass,simple majority
57777,2013-05-10T08:47:00,Vl.n.z.o veřejných rejstřících právnických a fyzických osob - EU,pass,simple majority
57632,2013-03-27T09:59:00,Pořad schůze,fail,simple majority
57754,2013-05-07T16:13:00,Vl.n.z.o opatřen.ke zvýšení transparentnosti akciových spol.,pass,all representatives majority
57105,2012-12-14T11:51:00,Novela z. o vysokých školách,pass,simple majority
57578,2013-03-20T15:00:00,Vl.n.z. o povinném značení lihu - EU,pass,simple majority
57802,2013-05-14T12:34:00,Pořad schůze,fail,simple majority
57843,2013-05-15T08:20:00,Novela z.o podmín. provozu vozidel na pozemních komunikacích - EU,pass,simple majority
57392,2013-02-13T09:31:00,Novela z. o technických požadavcích na výrobky - EU,pass,simple majority
58177,2013-08-08T13:30:00,"N.z., kterým se zrušuje karta sociálních systémů",fail,simple majority
57521,2013-03-19T13:58:00,Pořad schůze,pass,simple majority
57000,2012-12-11T13:41:00,Pořad schůze,fail,simple majority
57895,2013-05-15T14:08:00,Vl.n.z.o změně daň.zák. v souv. s rekodifikací soukrom.práva - EU,pass,simple majority
58231,2013-08-08T15:03:00,Vl.n.z. o statusu veřejné prospěšnosti,fail,simple majority
57405,2013-02-13T11:06:00,Novela z. - autorský zákon,pass,simple majority
57317,2013-02-08T11:02:00,Novela z. o jednacím řádu Poslanecké sněmovny,pass,simple majority
57807,2013-05-14T12:39:00,Pořad schůze,pass,simple majority
58233,2013-08-08T15:04:00,Vl.n.z. o statusu veřejné prospěšnosti,fail,simple majority
58270,2013-08-16T09:18:00,Novela z. o podporovaných zdrojích energie - EU,pass,simple majority
57495,2013-02-19T15:12:00,,pass,simple majority
57999,2013-06-11T13:55:00,Vl.n.z.o změně zák.v působ. MV v souv. s přij. kontrol. řádu,pass,simple majority
58158,2013-08-08T10:19:00,Vl.n.z.o změně daň.zák. v souv. s rekodifikací soukrom.práva - EU,fail,simple majority
58159,2013-08-08T10:19:00,Vl.n.z.o změně daň.zák. v souv. s rekodifikací soukrom.práva - EU,fail,simple majority
57560,2013-03-19T16:51:00,Novela z. - občanský soudní řád,pass,simple majority
57101,2012-12-14T11:47:00,Novela z. o vysokých školách,pass,simple majority
57694,2013-03-27T14:36:00,N.z. o Českém národním povstání,pass,simple majority
57019,2012-12-11T17:43:00,Novela z. o léčivech - EU,pass,simple majority
57852,2013-05-15T08:34:00,Vl.n.z. o investičních společnostech a investičních fondech - EU,pass,simple majority
57752,2013-05-07T16:11:00,Vl.n.z.o opatřen.ke zvýšení transparentnosti akciových spol.,pass,simple majority
58113,2013-07-17T15:39:00,Novela z. o vodovodech a kanalizacích - EU,fail,simple majority
57769,2013-05-10T08:11:00,Pořad schůze,pass,simple majority
57177,2012-12-19T17:46:00,Vl.n. nového zákona o státním rozpočtu ČR na rok 2013,fail,simple majority
58130,2013-08-07T10:08:00,Pořad schůze,pass,simple majority
57417,2013-02-13T14:09:00,Novela z. o státní sociální podpoře,pass,simple majority
58004,2013-06-11T14:18:00,Novela z. - obchodní zákoník - EU,fail,simple majority
58090,2013-07-17T15:00:00,Novela z. o ochraně zemědělského půdního fondu,pass,simple majority
58173,2013-08-08T10:55:00,Vl.n.z. o dani z nabytí nemovitých věcí,pass,simple majority
57616,2013-03-26T13:23:00,Pořad schůze,pass,simple majority
57081,2012-12-14T09:21:00,Pořad schůze,pass,simple majority
57776,2013-05-10T08:46:00,Vl.n.z.o veřejných rejstřících právnických a fyzických osob - EU,fail,simple majority
58271,2013-08-16T09:19:00,Novela z. o podporovaných zdrojích energie - EU,fail,simple majority
57846,2013-05-15T08:22:00,Novela z.o podmín. provozu vozidel na pozemních komunikacích - EU,fail,simple majority
58267,2013-08-16T08:05:00,Pořad schůze,pass,simple majority
