id,start_date,motion:text,motion:result,motion:requirement
57216,2013-02-05T14:49:00,Pořad schůze,pass,simple majority
57335,2013-02-12T13:53:00,Pořad schůze,fail,simple majority
57202,2013-02-05T14:37:00,Pořad schůze,pass,simple majority
57294,2013-02-07T11:53:00,Novela z. o obcích,pass,simple majority
57539,2013-03-19T14:15:00,Pořad schůze,pass,simple majority
57352,2013-02-12T14:18:00,Novela z. o dani z přidané hodnoty,pass,simple majority
57278,2013-02-07T10:37:00,Novela z. o poštovních službách,pass,simple majority
57030,2012-12-12T10:57:00,Novela z. o platu představitelů státní moci,pass,simple majority
57669,2013-03-27T13:39:00,Novela z. o pojišťovnictví,pass,simple majority
57867,2013-05-15T09:03:00,Novela z. o loteriích a jiných podobných hrách,pass,simple majority
57388,2013-02-13T09:23:00,Novela z. o silniční dopravě - EU,pass,simple majority
57279,2013-02-07T10:43:00,Prot.mezi ČR a Švýcarskou spol.radou o zamezení dvoj.zdanění,pass,simple majority
57369,2013-02-13T08:07:00,Pořad schůze,pass,simple majority
57140,2012-12-18T18:58:00,Novela z. - transplantační zákon - EU,fail,simple majority
57486,2013-02-19T12:52:00,Návrh PS na jmenování člena Rady pro rozhlasové a televizní vysílání,pass,simple majority
58068,2013-07-17T14:23:00,Novela z. o místních poplatcích,pass,simple majority
57767,2013-05-09T10:52:00,Vl.n.z. o Národním parku Šumava,pass,simple majority
57518,2013-03-19T13:55:00,Pořad schůze,pass,simple majority
57809,2013-05-14T12:44:00,Novela z. o odpadech - EU,fail,all representatives majority
57792,2013-05-14T12:25:00,Pořad schůze,fail,simple majority
57476,2013-02-19T12:32:00,Pořad schůze,fail,simple majority
57983,2013-06-11T13:15:00,Pořad schůze,pass,simple majority
57893,2013-05-15T13:31:00,Vl.n.z.o změně daň.zák. v souv. s rekodifikací soukrom.práva - EU,fail,simple majority
57021,2012-12-11T18:01:00,Novela z. o specifických zdravotních službách,pass,simple majority
57584,2013-03-21T10:12:00,Opční protokol k Úmluvě o právech dítěte,pass,simple majority
57764,2013-05-09T10:50:00,Vl.n.z. o Národním parku Šumava,fail,simple majority
58129,2013-07-17T16:18:00,Novela z. o státní sociální podpoře,pass,simple majority
57981,2013-06-11T13:13:00,Pořad schůze,pass,simple majority
57469,2013-02-19T12:27:00,Pořad schůze,pass,simple majority
58192,2013-08-08T13:52:00,Novela z. v souv. s přijetím rekodifikace soukromého práva - EU,pass,simple majority
57901,2013-05-15T14:42:00,Vl.n.z. o dani z nabytí nemovitých věcí,pass,simple majority
57933,2013-05-17T10:00:00,Vl.n.z. o katastru nemovitostí (katastrální zákon),fail,simple majority
58114,2013-07-17T15:41:00,Novela z. o vodovodech a kanalizacích - EU,pass,simple majority
57158,2012-12-19T08:14:00,Pořad schůze,fail,simple majority
57850,2013-05-15T08:28:00,Vl.n.z. o uvádění dřeva a dřevařských výrobků na trh - EU,pass,simple majority
57474,2013-02-19T12:31:00,Pořad schůze,fail,simple majority
57062,2012-12-13T10:17:00,Zpr. o využití doporučení veřejného ochránce práv,pass,simple majority
57824,2013-05-15T07:14:00,Pořad schůze,pass,simple majority
57240,2013-02-06T11:08:00,Vl.n.z. o mezinárodní spolupráci při správě daní - EU,pass,simple majority
57781,2013-05-10T09:21:00,Novela z. o soudních poplatcích,pass,simple majority
57982,2013-06-11T13:14:00,Pořad schůze,fail,simple majority
58291,2013-08-16T12:02:00,,pass,simple majority
58175,2013-08-08T12:51:00,Novela z. - tiskový zákon,fail,simple majority
57343,2013-02-12T13:58:00,Pořad schůze,pass,simple majority
58041,2013-06-19T07:12:00,Pořad schůze,fail,simple majority
58169,2013-08-08T10:48:00,Vl.n.z. o dani z nabytí nemovitých věcí,pass,simple majority
57699,2013-04-03T09:50:00,Novela z. o Vězeňské službě a justiční stráži ČR,pass,simple majority
58005,2013-06-11T14:19:00,Novela z. - obchodní zákoník - EU,pass,all representatives majority
57018,2012-12-11T17:06:00,Novela z. - transplantační zákon - EU,fail,simple majority
58017,2013-06-18T12:31:00,Pořad schůze,pass,simple majority
58108,2013-07-17T15:31:00,Novela z. o vodovodech a kanalizacích - EU,fail,simple majority
57201,2013-02-05T13:09:00,,pass,simple majority
57320,2013-02-08T11:05:00,Novela z. o jednacím řádu Poslanecké sněmovny,pass,simple majority
58048,2013-06-19T09:43:00,Zpr. o činnosti kontrol. rady GA ČR říjen 2012 - březen 2013,pass,simple majority
57890,2013-05-15T12:41:00,Zpráva o kontrole výročních finančních zpráv za rok 2012,pass,simple majority
57305,2013-02-08T10:51:00,Novela z. o jednacím řádu Poslanecké sněmovny,pass,simple majority
57067,2012-12-13T12:03:00,Návrh na změny zasedacího pořádku PS,pass,simple majority
57465,2013-02-15T12:00:00,Novela z. - zákoník práce,pass,simple majority
57772,2013-05-10T08:28:00,Novela z. o silničním provozu - EU,pass,simple majority
57315,2013-02-08T11:00:00,Novela z. o jednacím řádu Poslanecké sněmovny,fail,simple majority
57572,2013-03-20T11:26:00,Novela z. o zaměstnanosti,pass,simple majority
57927,2013-05-17T08:05:00,Pořad schůze,pass,simple majority
57703,2013-04-03T09:54:00,Novela z. o Vězeňské službě a justiční stráži ČR,pass,simple majority
58023,2013-06-18T12:37:00,Pořad schůze,pass,simple majority
58036,2013-06-18T14:43:00,Doh. mezi ČR a Čín. lid. repub. Hongkong o předávání osob,pass,simple majority
58104,2013-07-17T15:28:00,Novela z. o vodovodech a kanalizacích - EU,fail,simple majority
57598,2013-03-22T11:34:00,Informace ministryně práce a sociálních věcí k s-Kartám,pass,simple majority
57196,2012-12-19T18:45:00,,pass,simple majority
58260,2013-08-13T12:21:00,Pořad schůze,pass,simple majority
57111,2012-12-14T12:01:00,"Vl.n.z.,kterým se upravují otázky souvis. s užíváním bytů",fail,simple majority
58292,2013-08-16T12:04:00,Pořad schůze,pass,simple majority
57506,2013-02-19T17:02:00,Novela z. o léčivech - EU,fail,simple majority
57159,2012-12-19T08:15:00,Pořad schůze,pass,simple majority
57179,2012-12-19T17:48:00,Vl.n. nového zákona o státním rozpočtu ČR na rok 2013,fail,simple majority
58032,2013-06-18T14:29:00,Prot. proti nedovolené výrobě střelných zbraní,pass,simple majority
58222,2013-08-08T14:49:00,Vl.n.z.o veřejných rejstřících právnických a fyzických osob - EU,pass,simple majority
57698,2013-04-03T09:22:00,Návrh na volbu kandidáta viceprezidenta NKÚ,pass,simple majority
57487,2013-02-19T12:54:00,Návrh na volbu člena Rady Českého rozhlasu,pass,simple majority
57501,2013-02-19T15:54:00,"Vl.n.z.,kterým se upravují otázky souvis. s užíváním bytů",fail,simple majority
57559,2013-03-19T16:41:00,Vl.n.z. o zvláštních řízeních soudních - EU,pass,simple majority
57393,2013-02-13T10:48:00,Novela ústav. z. - Ústava České republiky,fail,simple majority
57978,2013-06-11T13:10:00,Pořad schůze,fail,simple majority
57555,2013-03-19T15:57:00,Novela z. - insolvenční zákon,pass,simple majority
57726,2013-05-07T13:57:00,Pořad schůze,fail,simple majority
57471,2013-02-19T12:28:00,Pořad schůze,pass,simple majority
57601,2013-03-22T11:37:00,Informace ministryně práce a sociálních věcí k s-Kartám,pass,simple majority
57172,2012-12-19T17:42:00,Vl.n. nového zákona o státním rozpočtu ČR na rok 2013,pass,simple majority
57517,2013-03-19T13:04:00,,pass,simple majority
57328,2013-02-08T12:01:00,Novela z. o dani z přidané hodnoty,pass,simple majority
57422,2013-02-13T15:04:00,Vl.n.z.o poskyt.st.záruky ČR na zajištění půjčky ČNB pro MMF,pass,simple majority
57712,2013-04-03T10:43:00,Návrh na jmenování členů KR TA ČR,pass,simple majority
57838,2013-05-15T07:57:00,Novela z. o ochraně veřejného zdraví - EU,pass,simple majority
58258,2013-08-13T12:19:00,Pořad schůze,pass,simple majority
57448,2013-02-15T08:14:00,Novela z. o silničním provozu,pass,simple majority
57680,2013-03-27T14:07:00,Vl.n.z. o státním občanství České republiky,pass,simple majority
58149,2013-08-08T10:12:00,Vl.n.z.o změně daň.zák. v souv. s rekodifikací soukrom.práva - EU,pass,simple majority
57594,2013-03-22T08:59:00,Novela ústavního z. - Ústava České republiky,fail,simple majority
57044,2012-12-12T14:01:00,Novela z. o Vězeňské službě a justiční stráži ČR,pass,simple majority
57502,2013-02-19T15:56:00,"Vl.n.z.,kterým se upravují otázky souvis. s užíváním bytů",pass,simple majority
57880,2013-05-15T10:33:00,Zpráva o inflaci - leden 2013,pass,simple majority
58120,2013-07-17T15:57:00,Novela z. o Státním pozemkovém úřadu,pass,simple majority
57731,2013-05-07T14:01:00,Pořad schůze,pass,simple majority
57566,2013-03-20T09:40:00,Novela z. o nakládání s těžebním odpadem - EU,pass,simple majority
57914,2013-05-16T09:57:00,Doh.zakládající přidružení mezi státy EU a Střední Amerikou,pass,simple majority
57847,2013-05-15T08:23:00,Novela z.o podmín. provozu vozidel na pozemních komunikacích - EU,pass,simple majority
57740,2013-05-07T14:08:00,Pořad schůze,pass,simple majority
58224,2013-08-08T14:50:00,Vl.n.z.o veřejných rejstřících právnických a fyzických osob - EU,pass,simple majority
57451,2013-02-15T08:48:00,Návrh Pravidel hospodaření poslaneckých klubů pro rok 2013,pass,simple majority
57562,2013-03-20T08:47:00,Novela z. o důchodovém pojištění,pass,simple majority
57922,2013-05-16T10:52:00,Vl.n.z. o prekursorech drog - EU,pass,simple majority
57339,2013-02-12T13:55:00,Pořad schůze,pass,simple majority
57833,2013-05-15T07:35:00,Novela z. o elektronických komunikacích,pass,simple majority
57681,2013-03-27T14:08:00,Vl.n.z. o státním občanství České republiky,pass,simple majority
58257,2013-08-13T12:18:00,Pořad schůze,fail,simple majority
57614,2013-03-26T13:21:00,Pořad schůze,pass,simple majority
57237,2013-02-06T11:04:00,Vl.n.ústav.z. o rozpočtové odpovědnosti - EU,fail,simple majority
58153,2013-08-08T10:15:00,Vl.n.z.o změně daň.zák. v souv. s rekodifikací soukrom.práva - EU,fail,simple majority
57840,2013-05-15T08:03:00,Novela z. o obchodu s reprodukčním materiálem lesních dřevin - EU,pass,simple majority
58002,2013-06-11T14:05:00,Novela z. o insolvenčních správcích,fail,simple majority
57528,2013-03-19T14:04:00,Pořad schůze,pass,simple majority
57976,2013-06-11T13:09:00,Pořad schůze,pass,simple majority
57963,2013-06-11T12:07:00,,pass,simple majority
57420,2013-02-13T14:21:00,Novela z. o místních poplatcích,pass,simple majority
57394,2013-02-13T10:49:00,Novela ústav. z. - Ústava České republiky,pass,simple majority
58053,2013-07-17T08:06:00,,pass,simple majority
57796,2013-05-14T12:28:00,Pořad schůze,pass,simple majority
57757,2013-05-09T07:17:00,Písemná interpelace J. Paroubka na P. Nečase ve věci daňových úniků na,fail,simple majority
57160,2012-12-19T08:20:00,,pass,simple majority
58255,2013-08-13T12:16:00,Pořad schůze,pass,simple majority
57065,2012-12-13T12:02:00,Návrh na změny zasedacího pořádku PS,pass,simple majority
57373,2013-02-13T08:16:00,Vl.n.z.o změně zák.v souv.s přijetím z.o mezin.just.spolupr. - EU,pass,simple majority
58279,2013-08-16T09:25:00,Novela z. o podporovaných zdrojích energie - EU,fail,simple majority
57832,2013-05-15T07:34:00,Novela z. o elektronických komunikacích,pass,simple majority
57464,2013-02-15T11:59:00,Novela z. - zákoník práce,pass,simple majority
57119,2012-12-18T17:12:00,Pořad schůze,fail,simple majority
57034,2012-12-12T11:00:00,Novela z. o platu představitelů státní moci,fail,simple majority
57948,2013-05-17T10:18:00,Vl.n.z.o změně zák.v souvisl. s přij. z. o katastr. nemovit.,pass,simple majority
58107,2013-07-17T15:30:00,Novela z. o vodovodech a kanalizacích - EU,fail,simple majority
58010,2013-06-12T07:08:00,Pořad schůze,pass,simple majority
57217,2013-02-05T14:49:00,Pořad schůze,fail,simple majority
57197,2013-01-17T09:04:00,,pass,simple majority
57169,2012-12-19T11:58:00,Návrh na změny ve složení orgánů Poslanecké sněmovny,pass,simple majority
57805,2013-05-14T12:37:00,Pořad schůze,pass,simple majority
58251,2013-08-08T16:01:00,Novela z. o sociálních službách,pass,simple majority
57765,2013-05-09T10:51:00,Vl.n.z. o Národním parku Šumava,pass,simple majority
57930,2013-05-17T08:23:00,Novela z. o sdružování v politických stranách a hnutích,pass,simple majority
57510,2013-02-19T17:08:00,Novela z. o léčivech - EU,pass,simple majority
57043,2012-12-12T13:57:00,Novela z. o insolvenčních správcích,pass,simple majority
57312,2013-02-08T10:57:00,Novela z. o jednacím řádu Poslanecké sněmovny,pass,simple majority
58166,2013-08-08T10:27:00,Vl.n.z.o změně daň.zák. v souv. s rekodifikací soukrom.práva - EU,pass,simple majority
57553,2013-03-19T14:44:00,Informace ministryně práce a sociálních věcí k S-kartám,pass,simple majority
57649,2013-03-27T11:20:00,Novela z. - obchodní zákoník - EU,pass,simple majority
57122,2012-12-18T17:19:00,Pořad schůze,pass,simple majority
58154,2013-08-08T10:16:00,Vl.n.z.o změně daň.zák. v souv. s rekodifikací soukrom.práva - EU,fail,simple majority
57232,2013-02-05T15:02:00,Pořad schůze,pass,simple majority
57256,2013-02-06T15:54:00,Vl.n.z. o uvádění dřeva a dřevařských výrobků na trh - EU,pass,simple majority
58027,2013-06-18T13:04:00,Vl.n.z. o Vojenské policii - EU,pass,simple majority
57424,2013-02-14T10:23:00,,pass,simple majority
57350,2013-02-12T14:16:00,Novela z. o dani z přidané hodnoty,fail,simple majority
57829,2013-05-15T07:20:00,Pořad schůze,pass,simple majority
57891,2013-05-15T12:45:00,Doplnění výročních finančních zpráv za roky 2006 až 2011,pass,simple majority
58141,2013-08-08T09:40:00,Pořad schůze,pass,simple majority
57478,2013-02-19T12:38:00,Novela z. o azylu a Policii ČR - EU,pass,simple majority
57928,2013-05-17T08:06:00,Pořad schůze,pass,simple majority
57022,2012-12-12T08:07:00,Pořad schůze,pass,simple majority
57080,2012-12-14T09:20:00,Pořad schůze,pass,simple majority
57015,2012-12-11T16:15:00,N.z. o obětech trestných činů - EU,pass,simple majority
57131,2012-12-18T18:21:00,Vl.n.z. o audiovizi,pass,all representatives majority
57654,2013-03-27T11:27:00,,pass,simple majority
57130,2012-12-18T18:10:00,Novela z. o sociálně-právní ochraně dětí,pass,simple majority
57098,2012-12-14T11:30:00,Novela z. o specifických zdravotních službách,pass,simple majority
57946,2013-05-17T10:12:00,Vl.n.z. o katastru nemovitostí (katastrální zákon),pass,simple majority
58144,2013-08-08T09:52:00,Vl.n.z. o katastru nemovitostí (katastrální zákon),pass,simple majority
57707,2013-04-03T10:11:00,Novela z. o státních svátcích,fail,simple majority
57145,2012-12-18T19:01:00,Novela z. - transplantační zákon - EU,pass,simple majority
57137,2012-12-18T18:56:00,Novela z. - transplantační zákon - EU,pass,simple majority
58085,2013-07-17T14:55:00,Novela z. o ochraně zemědělského půdního fondu,fail,simple majority
57016,2012-12-11T16:19:00,Novela z. o veřejném zdravotním pojištění,pass,simple majority
57361,2013-02-12T17:23:00,N.z. o Národním parku Šumava,fail,simple majority
57696,2013-04-03T09:19:00,Pořad schůze,fail,simple majority
57884,2013-05-15T10:46:00,Novela z. o pohonných hmotách,fail,simple majority
57275,2013-02-07T10:28:00,Zpráva o extremismu na území ČR v roce 2011,pass,simple majority
57723,2013-05-07T13:54:00,Pořad schůze,fail,simple majority
58007,2013-06-11T14:26:00,Vl.n.z. o státním občanství České republiky,pass,all representatives majority
57446,2013-02-15T08:09:00,Pořad schůze,pass,simple majority
57609,2013-03-22T12:48:00,Novela ústav. z. - Ústava České republiky,pass,simple majority
58156,2013-08-08T10:17:00,Vl.n.z.o změně daň.zák. v souv. s rekodifikací soukrom.práva - EU,fail,simple majority
58021,2013-06-18T12:36:00,Pořad schůze,pass,simple majority
57909,2013-05-16T09:33:00,Prot.mezi ČR a Slov.rep.o právní pomoci poskyt.justič.orgány,pass,simple majority
58127,2013-07-17T16:16:00,Novela z. o státní sociální podpoře,pass,simple majority
57790,2013-05-10T11:49:00,Novela z. o státní sociální podpoře,pass,simple majority
57219,2013-02-05T14:51:00,Pořad schůze,fail,simple majority
57194,2012-12-19T18:43:00,Návrh na potvrzení předsedů výborů Poslanecké sněmovny,pass,simple majority
57246,2013-02-06T11:53:00,Novela z. o stavebním spoření - EU,pass,simple majority
57477,2013-02-19T12:33:00,Pořad schůze,pass,simple majority
57881,2013-05-15T10:44:00,Novela z. o pohonných hmotách,pass,simple majority
57260,2013-02-06T16:23:00,Novela z. o pojišťovacích zprostředkovatelích - EU,pass,simple majority
58168,2013-08-08T10:46:00,Vl.n.z. o dani z nabytí nemovitých věcí,pass,simple majority
58188,2013-08-08T13:48:00,Novela z. v souv. s přijetím rekodifikace soukromého práva - EU,pass,simple majority
57085,2012-12-14T11:02:00,Informace ministryně obrany o změnách na ministerstvu obrany,fail,simple majority
57404,2013-02-13T11:05:00,Novela z. - autorský zákon,fail,simple majority
57655,2013-03-27T11:31:00,Novela z. o insolvenčních správcích,pass,simple majority
57547,2013-03-19T14:21:00,Pořad schůze,pass,simple majority
57684,2013-03-27T14:10:00,Vl.n.z. o státním občanství České republiky,fail,simple majority
57815,2013-05-14T16:10:00,"N.z., kterým se zrušuje karta sociálních systémů",fail,simple majority
57423,2013-02-14T10:21:00,1. doplněk plánu voj. cvičení AČR v roce 2012,pass,simple majority
57211,2013-02-05T14:45:00,Pořad schůze,fail,simple majority
57593,2013-03-22T08:09:00,Vl.n.z. o Vojenské policii - EU,pass,simple majority
57845,2013-05-15T08:21:00,Novela z.o podmín. provozu vozidel na pozemních komunikacích - EU,fail,simple majority
57071,2012-12-14T09:13:00,Pořad schůze,pass,simple majority
57599,2013-03-22T11:35:00,Informace ministryně práce a sociálních věcí k s-Kartám,pass,simple majority
57966,2013-06-11T12:58:00,Pořad schůze,fail,simple majority
57047,2012-12-12T14:22:00,Novela z. - autorský zákon,pass,simple majority
57964,2013-06-11T12:56:00,Pořad schůze,pass,simple majority
57947,2013-05-17T10:14:00,Vl.n.z. o katastru nemovitostí (katastrální zákon),pass,simple majority
57959,2013-05-17T11:12:00,Vl.n.z. o převodu vlastnického práva,pass,simple majority
57024,2012-12-12T08:08:00,Pořad schůze,pass,simple majority
57915,2013-05-16T10:06:00,Doh.mezi ČR a vl.Kajmanských os. o výměně inf.v daň.zálež.,pass,simple majority
57040,2012-12-12T13:37:00,Návrh na potvrzení předsedkyně petičního výboru,pass,simple majority
57288,2013-02-07T11:11:00,Doh.zakládající přidružení mezi státy EU a Střední Amerikou,pass,simple majority
57447,2013-02-15T08:13:00,Novela z. o silničním provozu,pass,simple majority
57998,2013-06-11T13:44:00,Novela z. o evidenci obyvatel,fail,simple majority
57435,2013-02-14T11:16:00,Úmluva MOP č. 189 o pracovnících v cizí domácnosti,pass,simple majority
57075,2012-12-14T09:16:00,Pořad schůze,fail,simple majority
57300,2013-02-08T09:33:00,Novela z. o státních svátcích,pass,simple majority
57803,2013-05-14T12:36:00,Pořad schůze,pass,simple majority
57552,2013-03-19T14:25:00,Pořad schůze,pass,simple majority
57403,2013-02-13T11:05:00,Novela z. - autorský zákon,fail,simple majority
57086,2012-12-14T11:09:00,Novela z. o léčivech - EU,pass,simple majority
57063,2012-12-13T10:30:00,Informace ministra financí o nehorázně vysokých platech úředníků,pass,simple majority
58082,2013-07-17T14:40:00,Novela z. o směnárenské činnosti - související,pass,simple majority
57711,2013-04-03T10:31:00,Novela z. o nakládání s těžebním odpadem - EU,pass,simple majority
57661,2013-03-27T12:12:00,Novela z. o pojišťovnictví,fail,simple majority
57952,2013-05-17T10:37:00,Novela z. o Státním pozemkovém úřadu,pass,simple majority
57523,2013-03-19T13:59:00,Pořad schůze,pass,simple majority
57722,2013-05-07T13:53:00,Pořad schůze,pass,simple majority
57359,2013-02-12T16:32:00,Novela z. - zákoník práce,pass,simple majority
58139,2013-08-07T17:47:00,Žádost vlády České republiky o vyslovení důvěry,pass,simple majority
57323,2013-02-08T11:13:00,Novela z. o jednacím řádu Senátu,pass,simple majority
57656,2013-03-27T11:31:00,Novela z. o insolvenčních správcích,fail,simple majority
57561,2013-03-19T16:55:00,Novela z. o výkonu vazby,pass,simple majority
58273,2013-08-16T09:21:00,Novela z. o podporovaných zdrojích energie - EU,pass,simple majority
57333,2013-02-12T13:51:00,Pořad schůze,fail,simple majority
57104,2012-12-14T11:49:00,Novela z. o vysokých školách,fail,simple majority
57839,2013-05-15T08:02:00,Novela z. o obchodu s reprodukčním materiálem lesních dřevin - EU,pass,simple majority
58191,2013-08-08T13:51:00,Novela z. v souv. s přijetím rekodifikace soukromého práva - EU,fail,simple majority
58184,2013-08-08T13:44:00,Novela z. v souv. s přijetím rekodifikace soukromého práva - EU,fail,simple majority
57986,2013-06-11T13:19:00,Pořad schůze,pass,simple majority
57932,2013-05-17T09:59:00,Vl.n.z. o katastru nemovitostí (katastrální zákon),fail,simple majority
57950,2013-05-17T10:31:00,Novela z. o platu představitelů státní moci,fail,simple majority
58044,2013-06-19T07:32:00,Sml. mezi ČR a SRN o přeshraniční spolupráci,pass,simple majority
58077,2013-07-17T14:34:00,Vládní návrh zákona o směnárenské činnosti - EU,pass,simple majority
58088,2013-07-17T14:58:00,Novela z. o ochraně zemědělského půdního fondu,pass,simple majority
57791,2013-05-14T12:23:00,Pořad schůze,pass,simple majority
57009,2012-12-11T14:18:00,Novela z. o technických požadavcích na výrobky - EU,pass,simple majority
57346,2013-02-12T14:01:00,Pořad schůze,fail,simple majority
57875,2013-05-15T09:41:00,Novela z. o České národní bance - EU,pass,simple majority
58124,2013-07-17T16:06:00,Novela z. o návykových látkách,pass,simple majority
58204,2013-08-08T14:11:00,Novela z. - občanský soudní řád,pass,simple majority
58167,2013-08-08T10:28:00,Vl.n.z.o změně daň.zák. v souv. s rekodifikací soukrom.práva - EU,pass,simple majority
57428,2013-02-14T10:44:00,Inf. o přeletech a průjezdech ozbroj. sil v 1. pol. 2012,pass,simple majority
57648,2013-03-27T11:19:00,Novela z. - obchodní zákoník - EU,pass,simple majority
57742,2013-05-07T14:10:00,Pořad schůze,fail,simple majority
57729,2013-05-07T14:00:00,Pořad schůze,pass,simple majority
57313,2013-02-08T10:58:00,Novela z. o jednacím řádu Poslanecké sněmovny,pass,simple majority
57396,2013-02-13T10:50:00,Novela ústav. z. - Ústava České republiky,pass,simple majority
57798,2013-05-14T12:30:00,Pořad schůze,pass,simple majority
57459,2013-02-15T10:51:00,N.z. o zřízení Krajského soudu v Liberci,pass,simple majority
58024,2013-06-18T12:51:00,Roční zpráva o výsledku hospodaření ČNB za rok 2012,fail,simple majority
57841,2013-05-15T08:05:00,Novela z. o obchodu s reprodukčním materiálem lesních dřevin - EU,pass,simple majority
57683,2013-03-27T14:09:00,Vl.n.z. o státním občanství České republiky,pass,simple majority
57532,2013-03-19T14:09:00,Pořad schůze,fail,simple majority
57060,2012-12-13T08:44:00,Pořad schůze,pass,simple majority
57303,2013-02-08T10:47:00,Novela z. o jednacím řádu Poslanecké sněmovny,pass,simple majority
57290,2013-02-07T11:17:00,Úml.o vzájemné správní pomoci v daň.záležitostech,pass,simple majority
57382,2013-02-13T09:04:00,Novela z. o odpadech - EU,fail,simple majority
57713,2013-04-03T10:45:00,Návrh na jmenování členů KR TA ČR,pass,simple majority
57556,2013-03-19T15:59:00,Novela z. - insolvenční zákon,fail,simple majority
57286,2013-02-07T11:10:00,Doh.zakládající přidružení mezi státy EU a Střední Amerikou,pass,simple majority
57365,2013-02-12T17:51:00,Novela z. o elektronických komunikacích,fail,simple majority
57218,2013-02-05T14:50:00,Pořad schůze,fail,simple majority
57955,2013-05-17T10:57:00,Novela z. o daních z příjmů,pass,simple majority
57187,2012-12-19T17:54:00,Vl.n. nového zákona o státním rozpočtu ČR na rok 2013,pass,simple majority
57450,2013-02-15T08:44:00,Novela ústav. z. - Ústava České republiky,pass,simple majority
57481,2013-02-19T12:41:00,Novela z. o azylu a Policii ČR - EU,pass,simple majority
57885,2013-05-15T10:47:00,Novela z. o pohonných hmotách,fail,simple majority
57659,2013-03-27T11:35:00,Novela z. o insolvenčních správcích,pass,simple majority
57190,2012-12-19T18:29:00,Rozpočet SFDI na rok 2013,pass,simple majority
58098,2013-07-17T15:19:00,Novela z. o výkonu vazby,pass,simple majority
58236,2013-08-08T15:06:00,Vl.n.z. o statusu veřejné prospěšnosti,fail,simple majority
57370,2013-02-13T08:11:00,Vl.n.z.o mezinárodní justiční spolupráci ve věcech trestních - EU,pass,simple majority
57276,2013-02-07T10:33:00,Sml.mezi ČR a Polskou rep. o společných státních hranicích,pass,simple majority
57357,2013-02-12T15:00:00,Novela z. o pojišťovnictví,pass,simple majority
57258,2013-02-06T16:03:00,Novela z. o směnárenské činnosti - související,pass,simple majority
57198,2013-01-17T09:28:00,Návrh na vyslovení nedůvěry vládě České republiky,pass,simple majority
57889,2013-05-15T10:59:00,Novela z. o regulaci reklamy - EU,fail,simple majority
58238,2013-08-08T15:08:00,Vl.n.z. o statusu veřejné prospěšnosti,pass,simple majority
57859,2013-05-15T08:50:00,Novela z. o pojišťování a fin. vývozu se státní podporou,pass,simple majority
